{
  "schema_version": "1.0",
  "candidate_id": "77777777-7777-4777-8777-777777777777",
  "tenant_id": "11111111-1111-4111-8111-111111111111",
  "world_id": "test-demo-001",
  "mode": "test",
  "kind": "property",
  "extraction_ref": "nl:Extraction/demo-002",
  "source_content_hash": "cccccccccccccccccccccccccccccccccccccccccccccccccccccccccccccccc",
  "extractor_version": "extractor-v1",
  "ontology_schema_revision": "schema-001",
  "proposed": {
    "name": "running_track_recording_need",
    "display_name": "跑步轨迹记录需求",
    "description": "顾客明确表示需要能记录跑步轨迹的设备（合成测试数据）",
    "owner_type_ref": "eios:ObjectType/Consumer",
    "value_type": "boolean",
    "closed_vocabulary": false,
    "property_group": "needs_intent"
  },
  "recall": [
    {
      "ref": "eios:Property/Consumer.gps_feature_interest",
      "method": "vector",
      "score": 0.71
    },
    {
      "ref": "eios:Property/Consumer.sports_mode_preference",
      "method": "fts",
      "score": 0.42
    }
  ],
  "merge_scores": {
    "lexical_similarity": 0.31,
    "core_term_containment": 0.5,
    "vector_cluster": 0.71,
    "rule_whitelist": 0.0,
    "weighted_total": 0.48,
    "best_match_ref": "eios:Property/Consumer.gps_feature_interest",
    "threshold": 0.8,
    "config_version": "merge-config-v1"
  },
  "status": "pending_review",
  "dependent_claim_refs": [
    "nl:Claim/demo-002-c04"
  ],
  "evidence_refs": [
    "nl:Message/demo-002-m11"
  ],
  "created_at": "2026-10-08T09:00:00Z"
}
